{
  "$schema": "https://json-schema.org/draft/2020-12/schema",
  "type": "object",
  "properties": {
    "schema_version": {
      "const": "accepted_output_capability_track_v1"
    },
    "tool_environment_hash": {
      "type": "string",
      "pattern": "^sha256:[0-9a-f]{64}$"
    },
    "execution_behavior_release_hash": {
      "type": "string",
      "pattern": "^sha256:[0-9a-f]{64}$"
    },
    "capability_binding_manifest_hash": {
      "type": "string",
      "pattern": "^sha256:[0-9a-f]{64}$"
    },
    "knot_coverage_manifest_hash": {
      "type": "string",
      "pattern": "^sha256:[0-9a-f]{64}$"
    },
    "capability_bundle_hash": {
      "type": "string",
      "pattern": "^sha256:[0-9a-f]{64}$"
    }
  },
  "required": [
    "schema_version",
    "tool_environment_hash",
    "execution_behavior_release_hash",
    "capability_binding_manifest_hash",
    "knot_coverage_manifest_hash",
    "capability_bundle_hash"
  ],
  "additionalProperties": false
}
