{"capability_binding_manifest_hash":"sha256:53bfb638bfa2fd2871b97c9ca24f2293a053915d4fa935266a7d4fa16d7b95b4","capability_bundle_hash":"sha256:f5ceeb56b70bb3a709aa6a6a3de41e2e584d76d0a15362e7cd6cb93e3a17baaf","execution_behavior_release_hash":"sha256:fd67c5f87bdae127ce45f96b0b808d116669bd9e1ad1d4cbc65238693072c5f6","knot_coverage_manifest_hash":"sha256:dafbedc17463e0871bacdf4d00dc780b0fd0f44f2e7cdb6fc0b4549e7490de24","schema_version":"accepted_output_capability_track_v1","tool_environment_hash":"sha256:3e2f86ce631139f590225217aa47a733ae1f3e12311c4fc9d26c8ab5cca97adb"}
